No,Title,Inventors,Publication number,Earliest priority,IPC,CPC,Publication date,Earliest publication,Family number,first publication date,second publication date,first publication number,second publication number,first publication country,second publication country,first filing year,earliest priority year,applicant country,first applicant,second applicant,first applicant type,second applicant type,Patent Age,patent cost,Patent Value,Market Rate,Mean Value,citations IPC
1,Plug-in hybrid vehicle with fast energy storage,"BENDER DONALD A [US] 
DESHMANE ATUL [US] 
MEANS ANDREW E [US]",US2006250902A1,2005-05-05,['H04B1/20'],"['B60K6/20 (KR)', 'B60K6/28 (KR)', 'B60K6/30 (EP,US)', 'B60K6/46 (EP,US)', 'B60K6/48 (EP,US)', 'B60K6/52 (EP,US)', 'B60K6/54 (EP,US)', 'B60L15/007 (EP,US)', 'B60L50/15 (EP,US)', 'B60L50/16 (EP,US)', 'B60L50/61 (EP,US)', 'B60L50/62 (EP,US)', 'B60L53/14 (EP,US)', 'B60L53/30 (EP,US)', 'B60L55/00 (EP,US)', 'B60L58/20 (EP,US)', 'H04B1/20 (KR)', 'B60K1/02 (EP,US)', 'B60L2260/28 (EP,US)', 'Y02E60/00 (EP,US)', 'Y02T10/62 (EP,US)', 'Y02T10/64 (EP,US)', 'Y02T10/70 (EP,US)', 'Y02T10/7072 (EP,US)', 'Y02T90/12 (EP,US)', 'Y02T90/14 (EP,US)', 'Y02T90/16 (US)', 'Y04S10/126 (EP,US)']",2006-11-09,2006-11-09,37397092,2006-11-09,,US2006250902A1,,US,,2006,2005,US,AFS TRINITY POWER CORP [US],,Company - General,Unknown,20,1500.0,1500.0,5190.485829959514,5190.485829959514,"['B60K1/00, B60K6/00, B60K6/28, B60K6/52, B60L11/00, B60L50/10, B60L50/15, B60W10/08, B60W10/26, B60W20/00', 'B60K6/04, B60K6/442, B60K6/48, B60W10/06, B60W10/08, B60W10/18, B60W10/26, B60W20/00', 'H02M3/24, H02M3/335, H02M3/335, H02M7/48', 'B60K1/00, B60L11/18', 'H02P9/04, B60K1/00, B60K6/20, B60K6/28, B60K6/445, B60L11/18, B60L15/20, B60L50/16, B60W10/06, B60W10/08, B60W10/26, B60W20/00, F02D17/00, F02D29/02, F02D29/06, F02D31/00, F02D41/14, F02D41/22, F02D45/00, F02N11/04, B60K1/02', 'H02P9/04, B60K6/00, F02M11/06, B60K6/20, B60K6/28, B60K6/445, B60L11/18, B60L15/20, B60L50/16, B60W10/06, B60W10/08, B60W10/26, B60W20/00, F02D17/00, F02D29/02, F02D29/06, F02D31/00, F02D41/14, F02D41/22, F02D45/00, F02N11/04, B60K1/02', 'B60L11/18, H02J7/00', 'B60K6/02, B60K6/40, B60K6/442, B60L50/15, B60W10/06, B60W10/08, B60W20/00', 'B60K1/04, B60K21/08, F16H37/00, B60K6/365, B60K6/445, B60W10/06, B60W10/08, B60W10/26, B60W20/00, F16H33/00, F16H37/00', 'B60K1/00, B60K41/04, F16H37/06, B60K6/10, F16H3/72, F16H33/02, B60K17/356', 'B60K1/04, B60K6/10, B60K6/30, B60K1/04, B60K6/20', 'B60K1/04, B60K6/04, B60K6/28, B60K6/46, B60L11/00, B60L11/18, B60L50/15, B60L7/10, B60T1/10, B60W10/06, B60W10/08, B60W10/26, B60W20/00, B60W30/18, H02J7/00, H02J9/06', 'B06L1/00, H01M12/00, H02J7/00, H02J7/00, H02J7/14, B60R16/02, B60R16/03', 'B60K6/02, H02P9/04, B60K17/04, B60K6/20, B60K6/44, B60K6/52, B60K6/543, B60K6/547, B60L7/12, B60L7/20, B60W10/08, B60W10/10, B60W10/18, B60W20/00, F16H61/02, F16H59/14, F16H59/44, F16H59/54, F16H59/70', 'H02P9/16, H02P9/20, B60T8/64, B60K1/00, B60K40/02, B60L11/00, B60P9/04, B60K17/356, B60K23/08, B60K25/00, B60K6/44, B60K6/52, B60L15/20, B60L50/16, B60L7/10, B60L7/20, B60T1/10, B60T13/58, B60T7/00, B60T8/17, B60T8/1766, B60T8/1769, B60T8/26, B60W10/08, B60W10/18, B60W20/00, F02D29/02']"
2,Electric vehicle wireless charging system through hydrogen power generation,SON JEONG KI [KR],KR20230163874A,2022-05-24,"['B60L53/12', 'B60L53/38', 'B60L53/54', 'B60L53/66', 'B60L53/68', 'G06Q20/14', 'G06Q50/30']","['B60L53/12 (KR)', 'B60L53/38 (KR)', 'B60L53/54 (KR)', 'B60L53/665 (KR)', 'B60L53/68 (KR)', 'G06Q20/145 (KR)', 'G06Q50/40 (KR)', 'B60Y2200/91 (KR)', 'Y02T90/12 (KR)']",2023-12-01,2023-12-01,89124565,2023-12-01,,KR20230163874A,,KR,,2023,2022,KR,SON JEONG KI [KR],,Individual Inventor,Unknown,3,4000.0,4000.0,5190.485829959514,5190.485829959514,"['B60L11/18, B60M7/00, H01M10/44, H02J3/32, H02J7/00, H02J7/02, H02J7/34', 'G06Q50/00, B60L11/18, H02J7/00', 'B60L11/18, G06Q50/30, H02J7/02', 'B60L53/10, B60L53/18, B60L53/35, F16H7/02, F16H7/06']"
3,Electric vehicle charging system using hydrogen fuel cell,HONG SEONG HO,KR102511391B1,2022-09-20,"['B60L3/00', 'B60L53/16', 'B60L53/51', 'B60L53/54', 'B60L53/57', 'B60L58/30', 'H01M8/04082', 'H05K7/20']",['Y02T10/70 (EP)'],2023-03-20,2023-03-20,85796535,2023-03-20,,KR102511391B1,,KR,,2023,2022,KR,HOGREENAIR CO LTD [KR],,Company - Limited,Unknown,3,4000.0,4000.0,5190.485829959514,5190.485829959514,"['B60L53/10, B60L53/24, B60L53/66, H02H5/04, H02H7/18, H02M3/00, H02M7/44', 'B60L53/10, B60L53/24, B60L53/66, H02H5/04, H02H7/18, H02M3/00, H02M7/44', 'F17C11/00, H01M8/04', 'C25B1/04, H01M10/44, H01M10/48, H01M8/00, H01M8/04, H02J15/00, H02J3/32, H02J3/38', 'B60K15/03, B60L3/00, B60L50/72, B60L53/30, B60P3/22']"
5,ESS SYSTEM FOR CHARGING FUEL CELL ELECTRIC VEHICLE AND ELECTRIC VEHICLE,"MUN TAEEUN [KR] 
CHAE HO BYUNG [KR] 
SHIN JONG HOON [KR]",US2022140365A1,2020-11-02,"['H01M16/00', 'H01M8/04828', 'H02J7/34']","['B60K15/03006 (KR)', 'B60L53/20 (KR)', 'B60L53/50 (KR)', 'B60L58/12 (KR)', 'B60L58/31 (KR)', 'H01M10/425 (EP)', 'H01M16/003 (US)', 'H01M16/006 (EP,KR)', 'H01M8/0494 (EP,US)', 'H01M8/04992 (EP)', 'H01M8/186 (KR)', 'H02J7/34 (EP,KR,US)', 'B60K2015/03315 (KR)', 'B60L2210/30 (KR)', 'B60Y2200/91 (KR)', 'H01M2010/4271 (EP)', 'H01M2220/10 (EP,KR)', 'H01M2220/20 (EP)', 'H01M2250/10 (EP,KR)', 'H01M2250/20 (EP,US)', 'H01M8/0494 (KR)', 'H02J2207/20 (EP,KR)', 'H02J2300/30 (EP)', 'Y02E60/10 (EP)', 'Y02E60/36 (EP)', 'Y02E60/50 (EP)', 'Y02T10/70 (EP,KR)', 'Y02T10/7072 (EP)', 'Y02T90/12 (EP)', 'Y02T90/14 (EP)', 'Y02T90/40 (EP,KR)']",2022-05-05,2021-03-17,75243546,2022-05-05,,US2022140365A1,,US,,2022,2020,KR,SIGNET EV INC [KR] ,SIGNET ENERGY [KR],Company - Incorporated/Corporation,Energy Company,5,7000.0,7000.0,5190.485829959514,5190.485829959514,"['B60L50/75, B60L53/30, B60L53/53, B60L53/54, F17D1/04, H02J7/02', 'H01M16/00, H01M8/04537, H01M8/04955, H02J1/10', 'C25B15/02, C25B9/18, H01M8/04', 'B60L50/70, B60L53/10, B60L53/54, H01M8/04082', 'H01M8/04, H01M8/10, H01M8/18, H01M16/00, H01M8/04, H01M8/06, H01M8/18, H01M8/10, H01M8/10, H01M8/12', 'C25B1/04, C25B9/00, H01M8/00, H01M8/04, H01M8/06, H01M8/12', 'H01M10/46, H01M8/04, H02M3/00', 'H01M4/86, H01M4/92, H01M8/0232, H01M8/0245, H01M8/0252, H01M8/0271, H01M8/04082, H01M8/18, H01M8/241', 'F24J2/00, F24S23/30, F24S50/20, H02J7/00, H02S10/20, H02S40/44, B60S5/02', 'C25B1/04, H01M10/44, H02J7/35', 'B64B1/24, B64D27/24, B64C39/02, B64D27/24, H01M16/00, H01M8/12']"
6,Method for quickly charging electric vehicle lead-acid storage battery,"CHENG HUANGREN 
HAN YIXI 
LI QINGBAO 
ZHAO XI",CN108550935A,2018-04-19,['H01M10/44'],"['H01M10/445 (CN)', 'Y02E60/10 (EP)']",2018-09-18,2018-09-18,63515557,2018-09-18,,CN108550935A,,CN,,2018,2018,,TIANJIN YADI IND CO LTD,,Company - Limited,Unknown,7,2000.0,2000.0,5190.485829959514,5190.485829959514,"['H01M10/44', 'H01M10/44, H02J7/00', 'H01M10/44, H02J7/02, H02J7/00, H02J7/04', 'H01M10/44, H02J7/00']"
7,Stable Charging Device for Methanol Hydrogen Production Electric Vehicle,CHEN JIEPING,"CN109263516A 
CN109263516B",2018-10-30,"['B60L58/31', 'H01M8/04082', 'H01M8/0612']","['H01M8/04201 (CN)', 'H01M8/0618 (CN)', 'H01M8/0625 (CN)', 'Y02E60/50 (EP)', 'Y02T90/40 (EP)']","2019-01-25 
2024-03-15",2019-01-25,65194032,2019-01-25,2024-03-15,CN109263516A,CN109263516B,CN,CN,2019,2018,,ZHEJIANG QINGGU NEW ENERGY AUTOMOBILE CO LTD,,Company - Limited,Unknown,7,2000.0,2000.0,5190.485829959514,5190.485829959514,"['H02J7/00', 'B60L11/18', '', 'B60L1/00, B60L11/18, B60L15/00', 'B60L11/18, H01M10/44, H01M10/48, H02J7/00, B60L58/10, B60L58/12', 'B60L11/00, B60L11/18, H01M8/04007, H01M8/04089, H01M8/0432, H01M8/0438, H01M8/04537, H01M8/04694, H01M8/0606, H01M8/1007', 'B60L50/71, B60L50/72, B60L50/75, H01M8/04082, H01M8/0612']"
8,AUTOMATIC CHARGING SYSTEM FOR ELECTRIC VEHICLE,CHEN WEN-LO [TW],US2013093378A1,2011-10-17,['H02J7/00'],"['B60L50/72 (EP,US)', 'B60L58/40 (EP,US)', 'B60L8/00 (EP,US)', 'C25B1/04 (EP,US)', 'C25B15/02 (EP,US)', 'C25B15/08 (EP,US)', 'H01M16/003 (EP,US)', 'H01M16/006 (EP,US)', 'H01M8/0656 (EP,US)', 'H01M2220/20 (EP,US)', 'H01M2250/20 (EP,US)', 'H02J2310/48 (EP)', 'Y02E60/10 (EP)', 'Y02E60/36 (EP,US)', 'Y02E60/50 (EP)', 'Y02T10/70 (EP)', 'Y02T10/7072 (EP,US)', 'Y02T90/40 (EP,US)']",2013-04-18,2013-04-18,48085546,2013-04-18,,US2013093378A1,,US,,2013,2011,TW,CHEN WEN-LO [TW],,Individual Inventor,Unknown,14,1500.0,1500.0,5190.485829959514,5190.485829959514,"['C02F1/46, C25B1/04, C25B1/06, H01M8/06, H01M8/22, C25B9/00, C25C7/00, C25D17/00, C02F1/469, C25B1/04, H01M8/04, H01M8/06, H01M8/18, C02F1/461, H01M16/00', 'H01M10/46, H01M16/00, H01M8/04, G05B19/00, H01M10/46, H01M16/00, H01M8/00, H01M8/04, H02H3/24, H02J3/28, H02J3/38, H02J9/06', 'H01M8/00, B60L11/18, B60L8/00, H01M8/00, H01M8/02, H01M8/04, H01M8/06, H01M8/10', 'F01B21/04, F01K23/00, F02B73/00, B63H21/20, B63H21/20, F01B21/04, F01K23/00, F01K25/00, F02B73/00', 'H01M16/00, H01M8/00, H01M8/04, H01M8/18, H02J3/38, H02J7/34, H02J9/06, H01M8/06', 'B63H11/14, B63H11/00', 'B63H13/00, F03D11/04, F03D9/00, F03D9/02, H02P9/04, B63C7/00', 'B64C3/38, B64C3/50', 'H01M8/06']"
11,Motor driving and lithium battery charging integrated method for hybrid electric vehicle,"CHEN JING 
TIAN SHAOPENG 
XIAO CHUN 
WANG YUNING 
YANG CAN 
QIN GUOFENG 
LI ZHIHUA 
GUO ZHENGYANG",CN112606713A,2020-12-10,"['B60L50/75', 'B60L58/40', 'H02J7/02', 'H02P27/06']","['B60L50/75 (CN)', 'B60L58/40 (CN)', 'H02J7/02 (CN)', 'H02P27/06 (CN)', 'B60L2210/10 (CN)', 'B60L2210/30 (CN)', 'Y02T10/64 (EP)', 'Y02T10/70 (EP)', 'Y02T90/40 (EP)']",2021-04-06,2021-04-06,75232631,2021-04-06,,CN112606713A,,CN,,2021,2020,,FOSHAN XIANHU LABORATORY,,University/Research Institution,Unknown,5,2000.0,2000.0,5190.485829959514,5190.485829959514,"['B60L11/18, H01M8/00, H01M8/04', 'B60L11/18, H01M10/44, H02J7/00, H02J7/35', 'B60K1/02, B60L50/50, B60L7/02, H02J1/10, H02J7/00, H02J7/34', 'B60L50/75, B60L58/40, H02J7/02, H02P27/06']"
12,HYDROGEN HYBRID ELECTRIC VEHICLE,"AHMAD REZAL KHAIRI BIN [MY] 
ZOLKIPLI MOHAMAD HAFIZ BIN [MY] 
ABDULLAH MOHAMAD SHAZWAN BIN [MY] 
SULAIMAN MOHD TAUFIK BIN [MY] 
PARDAMAN SINGH JAGJEET SINGH A/L [MY]",WO2023128748A1,2021-12-27,"['B60K6/26', 'B60K6/28', 'B60L15/20', 'B60L53/24', 'B60L58/40']","['B60K6/28 (EP)', 'B60K6/32 (EP)', 'B60K6/48 (EP)', 'B60L50/40 (EP)', 'B60L58/12 (EP)', 'B60L58/40 (EP)', 'H01M10/0525 (EP)', 'H01M16/003 (EP)', 'H01M16/006 (EP)', 'H01M4/583 (EP)', 'H01M8/0606 (EP)', 'H01M8/1004 (EP)', 'H01M2220/20 (EP)', 'H01M2250/20 (EP)', 'Y02T10/70 (EP)', 'Y02T90/40 (EP)']",2023-07-06,2023-07-06,86999818,2023-07-06,,WO2023128748A1,,WO,,2023,2021,MY,NANOMALAYSIA BERHAD [MY],,Material Science/Nanotechnology Company,Unknown,4,12000.0,12000.0,5190.485829959514,5190.485829959514,"['B60K1/02, B60K1/04, B60L11/00, B60L11/18, B64C27/12, B64C27/82', 'B01J19/00, H01M8/18, B01J7/00, B01J7/02, C01B3/00, C01B3/02, C01B3/04, C01B3/06, C01B3/08, H01M8/06', 'B60L1/00, B60L1/02, B60L58/26, B60L58/27, H01M10/42, H01M10/48, H01M12/06, H01M16/00, H01M4/62, H01M50/77', 'B60L11/18', 'B60L58/12, B60L58/40, G06F17/15']"
15,SYSTEM AND METHDO FOR CONTROLLING HYDROGEN ELECTRIC VEHICLE FOR USING AUXILIARY BREAK,SHIN JIN CHEOL,KR20210053589A,2019-11-04,"['B60L58/12', 'B60L58/40', 'B60L7/10', 'B60T13/74']","['B60L58/12 (KR)', 'B60L58/40 (KR)', 'B60L7/10 (KR)', 'B60T13/74 (KR)', 'B60L2240/62 (KR)', 'B60T2201/03 (KR)', 'B60T2270/60 (KR)', 'B60Y2200/91 (KR)', 'Y02T10/70 (EP,KR)', 'Y02T10/72 (EP)']",2021-05-12,2021-05-12,75918832,2021-05-12,,KR20210053589A,,KR,,2021,2019,KR,HYUNDAI MOTOR CO LTD [KR] ,KIA CORP [KR],Company - Limited,Company - General,6,4000.0,4000.0,5190.485829959514,5190.485829959514,"['B60L11/18', 'B60L11/18, B60L15/20, B60L7/10']"
16,New energy electric vehicle charging pile for city,"XU XIJIE 
YUAN PENGFEI","CN108674229A 
CN108674229B",2018-05-24,"['B60S5/02', 'B60L50/53', 'B60L53/31', 'B60L53/51', 'H02J7/00']","['B60L53/14 (CN)', 'B60L53/30 (CN)', 'B60L53/31 (CN)', 'B60L53/51 (CN)', 'B60S5/02 (CN)', 'Y02T10/70 (EP)', 'Y02T10/7072 (EP)', 'Y02T90/12 (EP)', 'Y02T90/14 (EP)']","2018-10-19 
2019-11-19",2018-10-19,63808137,2018-10-19,2019-11-19,CN108674229A,CN108674229B,CN,CN,2018,2018,,TAIZHOU LIWEI ENVIRONMENTAL PROTECTION TECH CO LTD,,Company - Limited,Unknown,7,2000.0,2000.0,5190.485829959514,5190.485829959514,"['B65B3/04, B60C19/08, H05F3/00', 'F03D9/11, H02H3/38, H02J7/00', 'B60K15/03, B60S5/02, F17C13/02, F17C5/06, H01M8/04', 'B60L11/18', 'H01M8/06, H01M8/22', 'G07F15/00, G07F9/00', 'B60L11/18, G07F11/00, G09F9/33, H02J7/00', 'B60L11/18', 'B60L11/18', 'H01M8/04082, H01M8/04089, H01M8/04746, F17C5/06, B65B1/04, H01M8/0432, H01M8/04082', 'B60L11/18, H02J7/00', 'H02J7/00, H02J7/35', 'B60L11/18, H02J7/14, H02J7/35']"
19,Vehicle charging system capable of hydrogen and electric charging,HONG SEONG HO,KR102511398B1,2022-09-20,"['B60L3/00', 'B60L53/16', 'B60L53/51', 'B60L53/54', 'B60L53/57', 'B60L58/30', 'H01M8/04082', 'H05K7/20']","['Y02T10/70 (EP)', 'Y02T10/7072 (EP)']",2023-03-20,2023-03-20,85796445,2023-03-20,,KR102511398B1,,KR,,2023,2022,KR,HOGREENAIR CO LTD [KR],,Company - Limited,Unknown,3,4000.0,4000.0,5190.485829959514,5190.485829959514,"['B60L53/10, B60L53/24, B60L53/66, H02H5/04, H02H7/18, H02M3/00, H02M7/44', 'B60L53/10, B60L53/24, B60L53/66, H02H5/04, H02H7/18, H02M3/00, H02M7/44', 'F17C11/00, H01M8/04', 'B60K15/03, B60L3/00, B60L50/72, B60L53/30, B60P3/22']"
22,Wind-light-electricity-hydrogen storage integrated charging and hydrogen charging system for expressway electric vehicle,"GUO WENLI 
GUO YEHENG 
KONG RUILEI 
LI PENGCHENG 
WANG MOLI",CN113085622A,2021-03-15,"['B60L53/31', 'B60L53/51', 'B60L53/52', 'F17C13/00', 'F17C5/06', 'F17C7/00', 'F17D1/04', 'F17D1/07', 'F17D1/20', 'H01M8/04082', 'H02J15/00']","['B60L53/31 (CN)', 'B60L53/51 (CN)', 'B60L53/52 (CN)', 'F17C13/00 (CN)', 'F17C5/06 (CN)', 'F17C7/00 (CN)', 'F17D1/04 (CN)', 'F17D1/07 (CN)', 'F17D1/20 (CN)', 'H01M8/04201 (CN)', 'H02J15/008 (CN)', 'F17C2221/012 (CN)', 'F17C2223/0123 (CN)', 'F17C2225/0123 (CN)', 'F17C2227/0157 (CN)', 'F17C2265/065 (CN)', 'Y02E60/32 (EP)', 'Y02E60/34 (EP)', 'Y02E60/36 (EP)', 'Y02E60/50 (EP)', 'Y02E70/30 (EP)', 'Y02T10/70 (EP)', 'Y02T10/7072 (EP)', 'Y02T10/72 (EP)', 'Y02T90/12 (EP)']",2021-07-09,2021-07-09,76667189,2021-07-09,,CN113085622A,,CN,,2021,2021,,HENAN HENGJU NEW ENERGY EQUIPMENT CO LTD,,Company - Limited,Unknown,4,4000.0,4000.0,5190.485829959514,5190.485829959514,"['C25B1/04, H02J7/35', 'C25B1/04, H02J7/35', 'H01M8/04089, H01M8/0656', 'B60L11/18, F02B43/10, F02B63/04, F17C11/00, F17C13/00, B60L53/31, B60L53/54', 'F03D3/04, F03D3/06', 'H02J3/32, H02J3/38', 'C25B9/04, C25B1/04, C25B15/02, H02J3/32, H02J3/38, H02J15/00, H02J3/28', 'F17C13/00, F17C13/04, F17C5/06', 'C25B9/19, H02J3/28, H02J3/38', 'C25B1/04, C25B15/00, F17B1/00, F17C13/04, F17C5/06, H02J3/28', 'F03D3/06, F03D7/06, F03D80/00', 'F01D15/10, F01K11/02, F01K7/32, F03D9/25, F03G6/06, H02J15/00, H02J3/28', 'F03D13/20, F03D3/06', 'F03D3/00, F03D80/70, F03D9/25, F16C19/10, F16C33/58', 'B60L53/51, B60L53/52, B60L53/54, B60L53/57, F03D9/00, F03D9/19, F03G6/00, F24S60/20, F24S60/30, F28D20/00, H02J1/00, H02S10/12, H02S10/20, F24S10/30, F24S30/452, H02J15/00, H02J7/35', 'E06C9/02, F03D13/20, F03D13/40, F03D80/00', 'C25B1/04, C25B9/65, F24S25/60', 'C25B1/04, C25B9/65, F17C1/00, F17C5/00, H02J15/00, H02J3/38, H02S10/12', 'H01M8/0606, H02J1/10, H02J7/34, H02J7/35']"
26,APPARATUS AND METHOD USING HYDROGEN PRESSURE IN FUEL CELL ELECTRIC VEHICLE,"MAJAROV KONSTANTIN S [US] 
O'MEARA THOMAS P [US]","US2010304228A1 
US8153309B2",2009-05-27,"['F02B63/00', 'H01M8/04', 'H01M8/06']","['F01B1/02 (EP,US)', 'F01B17/02 (EP,US)', 'H01M8/04067 (EP,US)', 'H01M8/04089 (EP,US)', 'H01M2250/20 (EP,US)', 'H01M2250/402 (EP,US)', 'H01M2250/407 (EP,US)', 'Y02B90/10 (EP,US)', 'Y02E60/50 (EP,US)', 'Y02T90/40 (EP,US)']","2010-12-02 
2012-04-10",2010-12-02,43220607,2010-12-02,2012-04-10,US2010304228A1,US8153309B2,US,US,2010,2009,US,GM GLOBAL TECH OPERATIONS INC [US] ,"MAJAROV KONSTANTIN S [US] 
O'MEARA THOMAS P [US]",Company - Incorporated/Corporation,Individual Inventor,16,1500.0,1500.0,5190.485829959514,5190.485829959514,"['H01M8/10, H01M8/02, H01M8/10', 'F04F1/00, H01M8/04, F04B43/073, F04B9/115, H01M8/04', 'H01M8/04, H01M8/12, H01M4/48', 'H01M8/18, B60L11/18, H01M8/06, H01M8/18, H01M16/00, H01M8/04', 'H01M8/06, H01M8/04, H01M8/06', 'H01M8/00, H01M8/04, H01M8/12, H01M8/18', 'H01M8/04, H01M8/12, B64D11/02, F02C6/04, H01M8/04, H01M8/12', 'H01M8/04, H01M8/06, B60L11/18, F02C6/00, H01M8/00, H01M8/04, H01M8/06, H01M8/12']"
28,HYBRID PLUG-IN BATTERY AND HYDROGEN FUEL ENGINE VEHICLE WITH SWAPPABLE HYDROGEN TANKS AND METHOD FOR MODULAR HYDROGEN STORAGE AND TRANSPORTATION AND DISTRIBUTION,WANG YONGHUA [US],"US12005772B2 
US2022402354A1",2021-06-17,"['B60K15/01', 'B60K15/03', 'F02B43/10', 'H01M10/42', 'H01M10/44', 'H01M10/46', 'H02J7/35', 'B60K15/00', 'F02B13/10']","['B60K15/00 (US)', 'B60K15/01 (EP,US)', 'B60K15/013 (EP)', 'B60K15/03 (US)', 'B60K15/03006 (EP)', 'B60K15/07 (CN)', 'B60K6/24 (CN)', 'B60K6/28 (CN)', 'B60L50/71 (EP)', 'B60L50/72 (EP)', 'B60L50/75 (EP)', 'B60L8/003 (CN)', 'F02B13/10 (US)', 'F02B43/10 (US)', 'H01M10/4257 (US)', 'H01M10/44 (US)', 'H01M10/465 (EP,US)', 'H01M50/249 (EP)', 'H01M8/04201 (EP)', 'H01M8/0656 (EP)', 'H01M8/1007 (EP)', 'H02J15/008 (EP)', 'H02J7/35 (EP,US)', 'B60K2015/03118 (CN)', 'B60K2015/03184 (EP,CN,US)', 'B60K2015/03315 (EP,CN,US)', 'C25B1/04 (EP)', 'C25B15/00 (EP)', 'F02B2043/106 (US)', 'H01M2010/4278 (US)', 'H01M2220/20 (EP,US)', 'H01M2250/20 (EP)', 'H02J2300/30 (EP)', 'H02J2310/48 (EP)', 'Y02E60/36 (US)']","2022-12-22 
2024-06-11",2022-12-22,84489982,2022-12-22,2024-06-11,US12005772B2,US2022402354A1,US,US,2022,2021,US,WANG YONGHUA [US],,Individual Inventor,Unknown,4,3500.0,3500.0,5190.485829959514,5190.485829959514,"['H01L31/00, H01L31/042', 'B60K6/20, F02M21/02, B60W20/00, F02D19/06, B60K6/20, F02M21/02']"
29,Pure electric vehicle powered by hydrogen energy,LIANG XINYAN,CN103350650A,2013-06-25,"['B60K1/00', 'B60L11/18', 'B60L15/00']","['Y02T10/70 (EP)', 'Y02T10/72 (EP)']",2013-10-16,2013-10-16,49307103,2013-10-16,,CN103350650A,,CN,,2013,2013,,CHERY AUTOMOBILE CO LTD,,Company - Limited,Unknown,12,4000.0,4000.0,5190.485829959514,5190.485829959514,"['B60K6/52, B60L11/18', 'B60L11/18, C01B3/00, C01B3/26, H01M8/04, B01B1/00, B60L11/18, C01B3/00, C01B3/34, C01B3/38, C01B3/50, H01M8/04, H01M8/06, C01B3/26', 'C01B3/32, C25B1/02, C25B5/00, B60L11/18, H01M8/0656, H01M8/0668', 'C01B3/26, H01M4/86, H01M8/02, H01M8/06, H01M8/10', '', 'B60L11/18', '', 'B60L11/00, B60L50/10, B60W10/08, B60W10/24']"
30,Charging system capable of preventing electric vehicle from moving during charging,"LU SHIMIN 
DOU WANKUN 
XU WENQING 
ZHU HONGJUN",CN108621843A,2018-05-10,['B60L3/00'],"['B60L3/00 (CN)', 'B60L53/00 (CN)', 'B60L53/60 (CN)', 'B60L2200/12 (CN)', 'Y02T10/70 (EP)', 'Y02T10/7072 (EP)', 'Y02T10/72 (EP)', 'Y02T90/12 (EP)', 'Y02T90/14 (EP)']",2018-10-09,2018-10-09,63692409,2018-10-09,,CN108621843A,,CN,,2018,2018,,JIANGSU KINGBON VEHICLE CO LTD,,Company - Limited,Unknown,7,2000.0,2000.0,5190.485829959514,5190.485829959514,"['H02J7/10', 'H02J7/00', 'H02J7/00', 'B60L1/00, B60L11/18', 'B60L3/00, B60L53/66']"
31,"ELECTRIC VEHICLE CHARGING SYSTEM USING MOBILE, FAST AND CLEAN ENERGY",CELIK AHMET OZAN [TR],WO2023146504A1,2021-01-28,"['B60L53/51', 'B60L53/66', 'B60L7/10', 'H02J7/35']","['B60L53/51 (EP)', 'B60L53/53 (EP)', 'B60L53/665 (EP)', 'B60L7/10 (EP)', 'H02J7/342 (EP)', 'H02J7/35 (EP)', 'Y02T10/70 (EP)', 'Y02T10/7072 (EP)', 'Y02T90/12 (EP)']",2023-08-03,2022-08-04,82653775,2023-08-03,,WO2023146504A1,,WO,,2023,2021,TR,ESKISEHIR TEKNIK UNIV [TR],,University/Research Institution,Unknown,4,12000.0,12000.0,5190.485829959514,5190.485829959514,"['B60L11/18, G06Q30/02, B60L53/10, B60L53/20, B60L53/51, B60L53/52, B60L58/12, H02J7/00', 'F03D9/00, H01L31/052, H02S30/20', 'B60H1/22, B60L11/18', 'H01L31/042, H02B1/46, H02B1/48', 'G06Q50/06, G06Q30/02, G06Q50/00', '']"
39,Mobile charging system for electric vehicle,XIANG HUA,CN106026340A,2016-06-17,"['H02J7/00', 'H02J7/35', 'H02S10/10', 'H02S10/12']","['H02J7/0063 (CN)', 'H02J7/35 (CN)', 'H02S10/10 (CN)', 'H02S10/12 (CN)', 'H02J2207/40 (CN)', 'Y02E10/50 (EP)']",2016-10-12,2016-10-12,57088718,2016-10-12,,CN106026340A,,CN,,2016,2016,,SHANGHAI HYDROGEN MOBILE REFORMER INSTR CO LTD,,Company - Limited,Unknown,9,2000.0,2000.0,5190.485829959514,5190.485829959514,"['B60L11/18, H02J50/12, H02J7/00', 'C01B3/38, C07C1/12, C07C29/151, C07C31/04, C07C9/04', 'C01B3/32, H01M8/04, H02J7/35, H02S10/10, H02S10/12', 'H01M8/06, H01M8/22']"
40,ELECTRIC VEHICLE CHARGING SYSTEM HAVING MOBILE CHARGER USING HYDROGEN FUEL CELL,"YOO JAE SIK [KR] 
CHOI SEONG HOON [KR]",WO2023195813A1,2022-04-08,"['B60L53/16', 'B60L53/24', 'B60L53/35', 'B60L53/54']","['B60L53/16 (EP,KR)', 'B60L53/24 (EP,KR)', 'B60L53/35 (EP,KR)', 'B60L53/54 (EP,KR)', 'B60Y2200/91 (KR)', 'Y02E60/50 (KR)', 'Y02T90/12 (KR)', 'Y02T90/14 (KR)', 'Y02T90/40 (KR)']",2023-10-12,2023-10-12,88243281,2023-10-12,,WO2023195813A1,,WO,,2023,2022,KR,INFINITE KOREA INC [KR],,Company - Incorporated/Corporation,Unknown,3,12000.0,12000.0,5190.485829959514,5190.485829959514,"['B25J11/00, B25J9/16, B60L50/50', 'B60L53/20, B60L53/50, B60L58/12, H01M16/00, H01M8/04828, H01M8/18, H02J7/34', 'B60L11/18, B60L50/10, B60L50/50', 'B60L11/18, G06Q50/30, H02J7/00', 'C25B1/04, H01M10/44, H02J7/35']"
41,Mobile electric vehicle charging system,"ZHANG RUIFENG 
WANG HAIFAN 
WU JIN 
ZHANG RUIJIE",CN106696746A,2017-01-19,"['B60L11/18', 'H02J7/00']","['B60L53/00 (CN)', 'B60L53/51 (CN)', 'B60L53/53 (CN)', 'B60L53/54 (CN)', 'H02J7/0027 (CN)', 'H02J7/0068 (CN)', 'Y02T10/70 (EP)', 'Y02T10/7072 (EP)', 'Y02T10/72 (EP)', 'Y02T90/12 (EP)', 'Y02T90/14 (EP)']",2017-05-24,2017-05-24,58909017,2017-05-24,,CN106696746A,,CN,,2017,2017,,DONGGUAN QINGXIN NEW ENERGY CO LTD,,Company - Limited,Unknown,8,2000.0,2000.0,5190.485829959514,5190.485829959514,"['H02M1/10', 'H02J7/00', 'B60L11/18, H02J7/00, H02J7/35', 'B60L11/18', 'B60L11/18, H02J7/00']"
43,Vehicle electric battery charging system,JULIAN MENASHE [BS],GB2631101A,2023-06-19,"['B60L53/66', 'B60L53/68']","['B60L50/10 (EP)', 'B60L50/50 (EP)', 'B60L50/75 (EP)', 'B60L53/65 (EP)', 'B60L53/66 (GB)', 'B60L53/665 (EP)', 'B60L53/67 (EP)', 'B60L53/68 (EP,GB)', 'B60L7/10 (EP)', 'B60L2240/12 (EP)', 'B60L2240/622 (EP)', 'B60L2240/70 (GB)', 'Y02T10/70 (EP)', 'Y02T10/7072 (EP)', 'Y02T90/10 (GB)', 'Y02T90/12 (EP)', 'Y02T90/16 (EP,GB)']",2024-12-25,2024-12-25,91738186,2024-12-25,,GB2631101A,,GB,,2024,2023,BS,JULIAN MENASHE [BS],,Individual Inventor,Unknown,2,1000.0,1000.0,5190.485829959514,5190.485829959514,"['H02J13/00, H02J7/00', 'H02J7/02', 'H02J7/00, B60K6/20, B60W10/00, H02J7/14']"
44,Apparatus for controlling charging of a storage battery for use on an electric vehicle,HOTTA YOSHIHIKO [JP],US5686812A,1995-02-06,"['H01M10/46', 'B60L1/00', 'B60L11/18', 'H02J7/00', 'H02J7/34']","['B60L1/003 (EP,US)', 'B60L1/02 (EP,US)', 'B60L3/0046 (US)', 'B60L53/14 (EP,US)', 'B60L53/22 (EP,US)', 'B60L58/14 (EP,US)', 'B60L58/15 (EP,US)', 'B60L58/26 (EP,US)', 'B60L58/27 (EP,US)', 'H02J7/0031 (EP,US)', 'H02J7/0068 (EP,US)', 'B60L2210/10 (EP,US)', 'B60L2210/30 (EP,US)', 'B60L2210/40 (EP,US)', 'B60L2240/545 (EP,US)', 'B60L2240/547 (EP,US)', 'B60L2240/549 (EP,US)', 'B60L2250/16 (EP,US)', 'B60L2260/22 (EP,US)', 'B60L2260/54 (EP,US)', 'Y02T10/70 (EP,US)', 'Y02T10/7072 (EP,US)', 'Y02T10/72 (EP,US)', 'Y02T90/12 (US)', 'Y02T90/14 (EP,US)', 'Y10S320/10 (EP,US)', 'Y10S320/11 (EP,US)']",1997-11-11,1996-08-20,11966471,1997-11-11,,US5686812A,,US,,1997,1995,JP,HONDA MOTOR CO LTD [JP],,Company - Limited,Unknown,30,16000.0,16000.0,5190.485829959514,5190.485829959514,"['H01M10/46, H02H11/00, H02J7/02, H02H11/00, H02J7/02', 'A47L9/00, H02J7/00, A47L5/24', 'H02J7/10, G01R31/02, G01R31/36, H01M10/44, H01M10/46', 'H01M10/44, H02J7/04, H01M10/44, H02J7/00, H02J7/10']"
45,"COMBINED HYDROGEN FUEL CELL FOR VEHICLE FUELING, ELECTRIC VEHICLE FAST CHARGING AND FUEL CELL BACK-UP POWER FORECOURT","VOLK JAMES JOSEPH [US] 
WENCK JAMES M [US] 
TAYLOR FRED [CA]",US2022227247A1,2021-01-21,"['B60L50/70', 'B60L53/10', 'B60L53/54', 'H01M8/04082']","['B60L50/70 (US)', 'B60L53/11 (EP)', 'B60L53/51 (EP)', 'B60L53/52 (EP)', 'B60L53/54 (EP,US)', 'H01M8/04201 (EP,US)', 'H01M8/0656 (EP)', 'C25B1/04 (EP,US)', 'C25B15/00 (EP)', 'H01M2250/20 (EP,US)', 'H01M2250/402 (EP,US)', 'Y02E60/36 (EP)', 'Y02E60/50 (EP)', 'Y02T10/70 (EP)', 'Y02T10/7072 (EP)', 'Y02T90/12 (EP)', 'Y02T90/40 (EP)']",2022-07-21,2022-07-21,82406830,2022-07-21,,US2022227247A1,,US,,2022,2021,US,GHD INC [US],,Company - Incorporated/Corporation,Unknown,4,3500.0,3500.0,5190.485829959514,5190.485829959514,['H02J9/06']
